{
  "schema_version": "3.0",
  "retained_photo_id": "photo-002",
  "result_id": "result-001",
  "storage_key": "photos/v1..2/photo_01.jpg",
  "content_fingerprint": "sha256:fixture-002",
  "media_type": "image/jpeg",
  "width": 1920,
  "height": 1080,
  "capture_method": "smartphone_camera_capture",
  "created_at": "2026-07-31T10:00:03Z",
  "lifecycle": "retained",
  "deletion": null
}
